Liedanfang,Quelle,Seite,Videolink
Görg von Frundsberg führt uns an,Sankt Georg,17,https://www.youtube.com/embed/pKs5YBuihZY?si=J4z5ofWI9PiCafK0
Weit lasst die Fahnen wehen,Sankt Georg,19,https://www.youtube.com/embed/LRCuczLEgQY?si=TiAwtEjm97CnQya6
Die Bauern wollten Freie sein,Sankt Georg,21,https://www.youtube.com/embed/g59J6TS_1Lg?si=aMjtn9-ZrrMNIXKZ
Es schlägt ein fremder Fink,Sankt Georg,25,https://www.youtube.com/embed/eDHf2Z1Q740?si=QcUZiTXTVD93g2io
Wenn die Landsknecht trinken,Sankt Georg,27f.,https://www.youtube.com/embed/t0TDmv3P0Cs?si=yzgq8vY0gQZF8V9Z
"Trum, trum, terum, tum, tum",Sankt Georg,32,https://www.youtube.com/embed/bclyXaitbDQ?si=a-gAu3Ualns3UrDj
Es klappert der Huf am Stege,Sankt Georg,33f.,https://www.youtube.com/embed/P8ewxPTdKi4?si=i-Li6puRhW1idffa
Das Kalbfell klingt,Sankt Georg,40,https://www.youtube.com/embed/OAF6uR2EuBI?si=v7MAa7RBSStYD9Od